id,book,chapter,verse,subtitle,text,verse_id,source_url,theme,emotion
110,revelation,6,14,,And the heaven departed as a scroll when it is rolled together; and every mountain and island were moved out of their places.,revelation_6_14,https://github.com/seven1m/open-bibles,,neutral
111,revelation,6,15,,"And the kings of the earth, and the great men, and the rich men, and the chief captains, and the mighty men, and every bondman, and every free man, hid themselves in the dens and in the rocks of the mountains;",revelation_6_15,https://github.com/seven1m/open-bibles,,neutral
112,revelation,6,16,,"And said to the mountains and rocks, Fall on us, and hide us from the face of him that sitteth on the throne, and from the wrath of the Lamb:",revelation_6_16,https://github.com/seven1m/open-bibles,,anger
113,revelation,6,17,,For the great day of his wrath is come; and who shall be able to stand?,revelation_6_17,https://github.com/seven1m/open-bibles,,anger
114,revelation,7,1,,"And after these things I saw four angels standing on the four corners of the earth, holding the four winds of the earth, that the wind should not blow on the earth, nor on the sea, nor on any tree.",revelation_7_1,https://github.com/seven1m/open-bibles,,disgust
115,revelation,7,2,,"And I saw another angel ascending from the east, having the seal of the living God: and he cried with a loud voice to the four angels, to whom it was given to hurt the earth and the sea,",revelation_7_2,https://github.com/seven1m/open-bibles,,disgust
116,revelation,7,3,,"Saying, Hurt not the earth, neither the sea, nor the trees, till we have sealed the servants of our God in their foreheads.",revelation_7_3,https://github.com/seven1m/open-bibles,,sadness
117,revelation,7,4,,And I heard the number of them which were sealed: and there were sealed an hundred and forty and four thousand of all the tribes of the children of Israel.,revelation_7_4,https://github.com/seven1m/open-bibles,,neutral
118,revelation,7,5,,Of the tribe of Juda were sealed twelve thousand. Of the tribe of Reuben were sealed twelve thousand. Of the tribe of Gad were sealed twelve thousand.,revelation_7_5,https://github.com/seven1m/open-bibles,,neutral
119,revelation,7,6,,Of the tribe of Aser were sealed twelve thousand. Of the tribe of Nepthalim were sealed twelve thousand. Of the tribe of Manasses were sealed twelve thousand.,revelation_7_6,https://github.com/seven1m/open-bibles,,neutral
120,revelation,7,7,,Of the tribe of Simeon were sealed twelve thousand. Of the tribe of Levi were sealed twelve thousand. Of the tribe of Issachar were sealed twelve thousand.,revelation_7_7,https://github.com/seven1m/open-bibles,,neutral
121,revelation,7,8,,Of the tribe of Zabulon were sealed twelve thousand. Of the tribe of Joseph were sealed twelve thousand. Of the tribe of Benjamin were sealed twelve thousand.,revelation_7_8,https://github.com/seven1m/open-bibles,,neutral
122,revelation,7,9,,"After this I beheld, and, lo, a great multitude, which no man could number, of all nations, and kindreds, and people, and tongues, stood before the throne, and before the Lamb, clothed with white robes, and palms in their hands;",revelation_7_9,https://github.com/seven1m/open-bibles,,disgust
123,revelation,7,10,,"And cried with a loud voice, saying, Salvation to our God which sitteth upon the throne, and unto the Lamb.",revelation_7_10,https://github.com/seven1m/open-bibles,,sadness
124,revelation,7,11,,"And all the angels stood round about the throne, and about the elders and the four beasts, and fell before the throne on their faces, and worshipped God,",revelation_7_11,https://github.com/seven1m/open-bibles,,disgust
125,revelation,7,12,,"Saying, Amen: Blessing, and glory, and wisdom, and thanksgiving, and honour, and power, and might, be unto our God for ever and ever. Amen.",revelation_7_12,https://github.com/seven1m/open-bibles,,joy
126,revelation,7,13,,"And one of the elders answered, saying unto me, What are these which are arrayed in white robes? and whence came they?",revelation_7_13,https://github.com/seven1m/open-bibles,,surprise
127,revelation,7,14,,"And I said unto him, Sir, thou knowest. And he said to me, These are they which came out of great tribulation, and have washed their robes, and made them white in the blood of the Lamb.",revelation_7_14,https://github.com/seven1m/open-bibles,,disgust
128,revelation,7,15,,"Therefore are they before the throne of God, and serve him day and night in his temple: and he that sitteth on the throne shall dwell among them.",revelation_7_15,https://github.com/seven1m/open-bibles,,neutral
129,revelation,7,16,,"They shall hunger no more, neither thirst any more; neither shall the sun light on them, nor any heat.",revelation_7_16,https://github.com/seven1m/open-bibles,,neutral
130,revelation,7,17,,"For the Lamb which is in the midst of the throne shall feed them, and shall lead them unto living fountains of waters: and God shall wipe away all tears from their eyes.",revelation_7_17,https://github.com/seven1m/open-bibles,,neutral
131,revelation,8,1,,"And when he had opened the seventh seal, there was silence in heaven about the space of half an hour.",revelation_8_1,https://github.com/seven1m/open-bibles,,neutral
132,revelation,8,2,,And I saw the seven angels which stood before God; and to them were given seven trumpets.,revelation_8_2,https://github.com/seven1m/open-bibles,,neutral
133,revelation,8,3,,"And another angel came and stood at the altar, having a golden censer; and there was given unto him much incense, that he should offer it with the prayers of all saints upon the golden altar which was before the throne.",revelation_8_3,https://github.com/seven1m/open-bibles,,anger
134,revelation,8,4,,"And the smoke of the incense, which came with the prayers of the saints, ascended up before God out of the angel's hand.",revelation_8_4,https://github.com/seven1m/open-bibles,,disgust
135,revelation,8,5,,"And the angel took the censer, and filled it with fire of the altar, and cast it into the earth: and there were voices, and thunderings, and lightnings, and an earthquake.",revelation_8_5,https://github.com/seven1m/open-bibles,,fear
136,revelation,8,6,,And the seven angels which had the seven trumpets prepared themselves to sound.,revelation_8_6,https://github.com/seven1m/open-bibles,,neutral
137,revelation,8,7,,"The first angel sounded, and there followed hail and fire mingled with blood, and they were cast upon the earth: and the third part of trees was burnt up, and all green grass was burnt up.",revelation_8_7,https://github.com/seven1m/open-bibles,,anger
138,revelation,8,8,,"And the second angel sounded, and as it were a great mountain burning with fire was cast into the sea: and the third part of the sea became blood;",revelation_8_8,https://github.com/seven1m/open-bibles,,anger
139,revelation,8,9,,"And the third part of the creatures which were in the sea, and had life, died; and the third part of the ships were destroyed.",revelation_8_9,https://github.com/seven1m/open-bibles,,sadness
140,revelation,8,10,,"And the third angel sounded, and there fell a great star from heaven, burning as it were a lamp, and it fell upon the third part of the rivers, and upon the fountains of waters;",revelation_8_10,https://github.com/seven1m/open-bibles,,anger
141,revelation,8,11,,"And the name of the star is called Wormwood: and the third part of the waters became wormwood; and many men died of the waters, because they were made bitter.",revelation_8_11,https://github.com/seven1m/open-bibles,,anger
142,revelation,8,12,,"And the fourth angel sounded, and the third part of the sun was smitten, and the third part of the moon, and the third part of the stars; so as the third part of them was darkened, and the day shone not for a third part of it, and the night likewise.",revelation_8_12,https://github.com/seven1m/open-bibles,,sadness
143,revelation,8,13,,"And I beheld, and heard an angel flying through the midst of heaven, saying with a loud voice, Woe, woe, woe, to the inhabiters of the earth by reason of the other voices of the trumpet of the three angels, which are yet to sound!",revelation_8_13,https://github.com/seven1m/open-bibles,,fear
144,revelation,9,1,,"And the fifth angel sounded, and I saw a star fall from heaven unto the earth: and to him was given the key of the bottomless pit.",revelation_9_1,https://github.com/seven1m/open-bibles,,fear
145,revelation,9,2,,"And he opened the bottomless pit; and there arose a smoke out of the pit, as the smoke of a great furnace; and the sun and the air were darkened by reason of the smoke of the pit.",revelation_9_2,https://github.com/seven1m/open-bibles,,disgust
146,revelation,9,3,,"And there came out of the smoke locusts upon the earth: and unto them was given power, as the scorpions of the earth have power.",revelation_9_3,https://github.com/seven1m/open-bibles,,disgust
147,revelation,9,4,,"And it was commanded them that they should not hurt the grass of the earth, neither any green thing, neither any tree; but only those men which have not the seal of God in their foreheads.",revelation_9_4,https://github.com/seven1m/open-bibles,,neutral
148,revelation,9,5,,"And to them it was given that they should not kill them, but that they should be tormented five months: and their torment was as the torment of a scorpion, when he striketh a man.",revelation_9_5,https://github.com/seven1m/open-bibles,,sadness
149,revelation,9,6,,"And in those days shall men seek death, and shall not find it; and shall desire to die, and death shall flee from them.",revelation_9_6,https://github.com/seven1m/open-bibles,,sadness
150,revelation,9,7,,"And the shapes of the locusts were like unto horses prepared unto battle; and on their heads were as it were crowns like gold, and their faces were as the faces of men.",revelation_9_7,https://github.com/seven1m/open-bibles,,neutral
151,revelation,9,8,,"And they had hair as the hair of women, and their teeth were as the teeth of lions.",revelation_9_8,https://github.com/seven1m/open-bibles,,disgust
152,revelation,9,9,,"And they had breastplates, as it were breastplates of iron; and the sound of their wings was as the sound of chariots of many horses running to battle.",revelation_9_9,https://github.com/seven1m/open-bibles,,neutral
153,revelation,9,10,,"And they had tails like unto scorpions, and there were stings in their tails: and their power was to hurt men five months.",revelation_9_10,https://github.com/seven1m/open-bibles,,disgust
154,revelation,9,11,,"And they had a king over them, which is the angel of the bottomless pit, whose name in the Hebrew tongue is Abaddon, but in the Greek tongue hath his name Apollyon.",revelation_9_11,https://github.com/seven1m/open-bibles,,neutral
155,revelation,9,12,,"One woe is past; and, behold, there come two woes more hereafter.",revelation_9_12,https://github.com/seven1m/open-bibles,,sadness
156,revelation,9,13,,"And the sixth angel sounded, and I heard a voice from the four horns of the golden altar which is before God,",revelation_9_13,https://github.com/seven1m/open-bibles,,fear
157,revelation,9,14,,"Saying to the sixth angel which had the trumpet, Loose the four angels which are bound in the great river Euphrates.",revelation_9_14,https://github.com/seven1m/open-bibles,,neutral
158,revelation,9,15,,"And the four angels were loosed, which were prepared for an hour, and a day, and a month, and a year, for to slay the third part of men.",revelation_9_15,https://github.com/seven1m/open-bibles,,neutral
159,revelation,9,16,,And the number of the army of the horsemen were two hundred thousand thousand: and I heard the number of them.,revelation_9_16,https://github.com/seven1m/open-bibles,,surprise
160,revelation,9,17,,"And thus I saw the horses in the vision, and them that sat on them, having breastplates of fire, and of jacinth, and brimstone: and the heads of the horses were as the heads of lions; and out of their mouths issued fire and smoke and brimstone.",revelation_9_17,https://github.com/seven1m/open-bibles,,anger
161,revelation,9,18,,"By these three was the third part of men killed, by the fire, and by the smoke, and by the brimstone, which issued out of their mouths.",revelation_9_18,https://github.com/seven1m/open-bibles,,disgust
162,revelation,9,19,,"For their power is in their mouth, and in their tails: for their tails were like unto serpents, and had heads, and with them they do hurt.",revelation_9_19,https://github.com/seven1m/open-bibles,,disgust
163,revelation,9,20,,"And the rest of the men which were not killed by these plagues yet repented not of the works of their hands, that they should not worship devils, and idols of gold, and silver, and brass, and stone, and of wood: which neither can see, nor hear, nor walk:",revelation_9_20,https://github.com/seven1m/open-bibles,,disgust
164,revelation,9,21,,"Neither repented they of their murders, nor of their sorceries, nor of their fornication, nor of their thefts.",revelation_9_21,https://github.com/seven1m/open-bibles,,disgust
165,revelation,10,1,,"And I saw another mighty angel come down from heaven, clothed with a cloud: and a rainbow was upon his head, and his face was as it were the sun, and his feet as pillars of fire:",revelation_10_1,https://github.com/seven1m/open-bibles,,disgust
166,revelation,10,2,,"And he had in his hand a little book open: and he set his right foot upon the sea, and his left foot on the earth,",revelation_10_2,https://github.com/seven1m/open-bibles,,fear
167,revelation,10,3,,"And cried with a loud voice, as when a lion roareth: and when he had cried, seven thunders uttered their voices.",revelation_10_3,https://github.com/seven1m/open-bibles,,sadness
168,revelation,10,4,,"And when the seven thunders had uttered their voices, I was about to write: and I heard a voice from heaven saying unto me, Seal up those things which the seven thunders uttered, and write them not.",revelation_10_4,https://github.com/seven1m/open-bibles,,fear
169,revelation,10,5,,"And the angel which I saw stand upon the sea and upon the earth lifted up his hand to heaven,",revelation_10_5,https://github.com/seven1m/open-bibles,,fear
170,revelation,10,6,,"And sware by him that liveth for ever and ever, who created heaven, and the things that therein are, and the earth, and the things that therein are, and the sea, and the things which are therein, that there should be time no longer:",revelation_10_6,https://github.com/seven1m/open-bibles,,neutral
171,revelation,10,7,,"But in the days of the voice of the seventh angel, when he shall begin to sound, the mystery of God should be finished, as he hath declared to his servants the prophets.",revelation_10_7,https://github.com/seven1m/open-bibles,,neutral
172,revelation,10,8,,"And the voice which I heard from heaven spake unto me again, and said, Go and take the little book which is open in the hand of the angel which standeth upon the sea and upon the earth.",revelation_10_8,https://github.com/seven1m/open-bibles,,fear
173,revelation,10,9,,"And I went unto the angel, and said unto him, Give me the little book. And he said unto me, Take it, and eat it up; and it shall make thy belly bitter, but it shall be in thy mouth sweet as honey.",revelation_10_9,https://github.com/seven1m/open-bibles,,disgust
174,revelation,10,10,,"And I took the little book out of the angel's hand, and ate it up; and it was in my mouth sweet as honey: and as soon as I had eaten it, my belly was bitter.",revelation_10_10,https://github.com/seven1m/open-bibles,,disgust
175,revelation,10,11,,"And he said unto me, Thou must prophesy again before many peoples, and nations, and tongues, and kings.",revelation_10_11,https://github.com/seven1m/open-bibles,,fear
176,revelation,11,1,,"And there was given me a reed like unto a rod: and the angel stood, saying, Rise, and measure the temple of God, and the altar, and them that worship therein.",revelation_11_1,https://github.com/seven1m/open-bibles,,disgust
177,revelation,11,2,,"But the court which is without the temple leave out, and measure it not; for it is given unto the Gentiles: and the holy city shall they tread under foot forty and two months.",revelation_11_2,https://github.com/seven1m/open-bibles,,neutral
178,revelation,11,3,,"And I will give power unto my two witnesses, and they shall prophesy a thousand two hundred and threescore days, clothed in sackcloth.",revelation_11_3,https://github.com/seven1m/open-bibles,,neutral
179,revelation,11,4,,"These are the two olive trees, and the two candlesticks standing before the God of the earth.",revelation_11_4,https://github.com/seven1m/open-bibles,,neutral
180,revelation,11,5,,"And if any man will hurt them, fire proceedeth out of their mouth, and devoureth their enemies: and if any man will hurt them, he must in this manner be killed.",revelation_11_5,https://github.com/seven1m/open-bibles,,anger
181,revelation,11,6,,"These have power to shut heaven, that it rain not in the days of their prophecy: and have power over waters to turn them to blood, and to smite the earth with all plagues, as often as they will.",revelation_11_6,https://github.com/seven1m/open-bibles,,anger
182,revelation,11,7,,"And when they shall have finished their testimony, the beast that ascendeth out of the bottomless pit shall make war against them, and shall overcome them, and kill them.",revelation_11_7,https://github.com/seven1m/open-bibles,,anger
183,revelation,11,8,,"And their dead bodies shall lie in the street of the great city, which spiritually is called Sodom and Egypt, where also our Lord was crucified.",revelation_11_8,https://github.com/seven1m/open-bibles,,disgust
184,revelation,11,9,,"And they of the people and kindreds and tongues and nations shall see their dead bodies three days and an half, and shall not suffer their dead bodies to be put in graves.",revelation_11_9,https://github.com/seven1m/open-bibles,,sadness
185,revelation,11,10,,"And they that dwell upon the earth shall rejoice over them, and make merry, and shall send gifts one to another; because these two prophets tormented them that dwelt on the earth.",revelation_11_10,https://github.com/seven1m/open-bibles,,sadness
186,revelation,11,11,,"And after three days and an half the Spirit of life from God entered into them, and they stood upon their feet; and great fear fell upon them which saw them.",revelation_11_11,https://github.com/seven1m/open-bibles,,fear
187,revelation,11,12,,"And they heard a great voice from heaven saying unto them, Come up hither. And they ascended up to heaven in a cloud; and their enemies beheld them.",revelation_11_12,https://github.com/seven1m/open-bibles,,fear
188,revelation,11,13,,"And the same hour was there a great earthquake, and the tenth part of the city fell, and in the earthquake were slain of men seven thousand: and the remnant were affrighted, and gave glory to the God of heaven.",revelation_11_13,https://github.com/seven1m/open-bibles,,joy
189,revelation,11,14,,"The second woe is past; and, behold, the third woe cometh quickly.",revelation_11_14,https://github.com/seven1m/open-bibles,,surprise
190,revelation,11,15,,"And the seventh angel sounded; and there were great voices in heaven, saying, The kingdoms of this world are become the kingdoms of our Lord, and of his Christ; and he shall reign for ever and ever.",revelation_11_15,https://github.com/seven1m/open-bibles,,neutral
191,revelation,11,16,,"And the four and twenty elders, which sat before God on their seats, fell upon their faces, and worshipped God,",revelation_11_16,https://github.com/seven1m/open-bibles,,disgust
192,revelation,11,17,,"Saying, We give thee thanks, O Lord God Almighty, which art, and wast, and art to come; because thou hast taken to thee thy great power, and hast reigned.",revelation_11_17,https://github.com/seven1m/open-bibles,,joy
193,revelation,11,18,,"And the nations were angry, and thy wrath is come, and the time of the dead, that they should be judged, and that thou shouldest give reward unto thy servants the prophets, and to the saints, and them that fear thy name, small and great; and shouldest destroy them which destroy the earth.",revelation_11_18,https://github.com/seven1m/open-bibles,,anger
194,revelation,11,19,,"And the temple of God was opened in heaven, and there was seen in his temple the ark of his testament: and there were lightnings, and voices, and thunderings, and an earthquake, and great hail.",revelation_11_19,https://github.com/seven1m/open-bibles,,fear
195,revelation,12,1,,"And there appeared a great wonder in heaven; a woman clothed with the sun, and the moon under her feet, and upon her head a crown of twelve stars:",revelation_12_1,https://github.com/seven1m/open-bibles,,surprise
196,revelation,12,2,,"And she being with child cried, travailing in birth, and pained to be delivered.",revelation_12_2,https://github.com/seven1m/open-bibles,,sadness
197,revelation,12,3,,"And there appeared another wonder in heaven; and behold a great red dragon, having seven heads and ten horns, and seven crowns upon his heads.",revelation_12_3,https://github.com/seven1m/open-bibles,,surprise
198,revelation,12,4,,"And his tail drew the third part of the stars of heaven, and did cast them to the earth: and the dragon stood before the woman which was ready to be delivered, for to devour her child as soon as it was born.",revelation_12_4,https://github.com/seven1m/open-bibles,,disgust
199,revelation,12,5,,"And she brought forth a man child, who was to rule all nations with a rod of iron: and her child was caught up unto God, and to his throne.",revelation_12_5,https://github.com/seven1m/open-bibles,,neutral
200,revelation,12,6,,"And the woman fled into the wilderness, where she hath a place prepared of God, that they should feed her there a thousand two hundred and threescore days.",revelation_12_6,https://github.com/seven1m/open-bibles,,neutral
201,revelation,12,7,,"And there was war in heaven: Michael and his angels fought against the dragon; and the dragon fought and his angels,",revelation_12_7,https://github.com/seven1m/open-bibles,,anger
202,revelation,12,8,,And prevailed not; neither was their place found any more in heaven.,revelation_12_8,https://github.com/seven1m/open-bibles,,neutral
203,revelation,12,9,,"And the great dragon was cast out, that old serpent, called the Devil, and Satan, which deceiveth the whole world: he was cast out into the earth, and his angels were cast out with him.",revelation_12_9,https://github.com/seven1m/open-bibles,,disgust
204,revelation,12,10,,"And I heard a loud voice saying in heaven, Now is come salvation, and strength, and the kingdom of our God, and the power of his Christ: for the accuser of our brethren is cast down, which accused them before our God day and night.",revelation_12_10,https://github.com/seven1m/open-bibles,,disgust
205,revelation,12,11,,"And they overcame him by the blood of the Lamb, and by the word of their testimony; and they loved not their lives unto the death.",revelation_12_11,https://github.com/seven1m/open-bibles,,neutral
206,revelation,12,12,,"Therefore rejoice, ye heavens, and ye that dwell in them. Woe to the inhabiters of the earth and of the sea! for the devil is come down unto you, having great wrath, because he knoweth that he hath but a short time.",revelation_12_12,https://github.com/seven1m/open-bibles,,anger
207,revelation,12,13,,"And when the dragon saw that he was cast unto the earth, he persecuted the woman which brought forth the man child.",revelation_12_13,https://github.com/seven1m/open-bibles,,disgust
208,revelation,12,14,,"And to the woman were given two wings of a great eagle, that she might fly into the wilderness, into her place, where she is nourished for a time, and times, and half a time, from the face of the serpent.",revelation_12_14,https://github.com/seven1m/open-bibles,,neutral
209,revelation,12,15,,"And the serpent cast out of his mouth water as a flood after the woman, that he might cause her to be carried away of the flood.",revelation_12_15,https://github.com/seven1m/open-bibles,,disgust
210,revelation,12,16,,"And the earth helped the woman, and the earth opened her mouth, and swallowed up the flood which the dragon cast out of his mouth.",revelation_12_16,https://github.com/seven1m/open-bibles,,disgust
211,revelation,12,17,,"And the dragon was wroth with the woman, and went to make war with the remnant of her seed, which keep the commandments of God, and have the testimony of Jesus Christ.",revelation_12_17,https://github.com/seven1m/open-bibles,,disgust
212,revelation,13,1,,"And I stood upon the sand of the sea, and saw a beast rise up out of the sea, having seven heads and ten horns, and upon his horns ten crowns, and upon his heads the name of blasphemy.",revelation_13_1,https://github.com/seven1m/open-bibles,,disgust
213,revelation,13,2,,"And the beast which I saw was like unto a leopard, and his feet were as the feet of a bear, and his mouth as the mouth of a lion: and the dragon gave him his power, and his seat, and great authority.",revelation_13_2,https://github.com/seven1m/open-bibles,,disgust
214,revelation,13,3,,And I saw one of his heads as it were wounded to death; and his deadly wound was healed: and all the world wondered after the beast.,revelation_13_3,https://github.com/seven1m/open-bibles,,surprise
215,revelation,13,4,,"And they worshipped the dragon which gave power unto the beast: and they worshipped the beast, saying, Who is like unto the beast? who is able to make war with him?",revelation_13_4,https://github.com/seven1m/open-bibles,,disgust
216,revelation,13,5,,And there was given unto him a mouth speaking great things and blasphemies; and power was given unto him to continue forty and two months.,revelation_13_5,https://github.com/seven1m/open-bibles,,disgust
