book,chapter,verse,subtitle,text,source_url
cantares,8,7,El poder del amor,"Las muchas aguas no podrán apagar el amor,
Ni lo ahogarán los ríos.
Si diese el hombre todos los bienes de su casa por este amor,
De cierto lo menospreciarían.",https://www.biblia.es/biblia-buscar-libros-1.php?libro=cantares&capitulo=8&version=rv60
cantares,8,8,El poder del amor,"Tenemos una pequeña hermana,
Que no tiene pechos;
¿Qué haremos a nuestra hermana
Cuando de ella se hablare?",https://www.biblia.es/biblia-buscar-libros-1.php?libro=cantares&capitulo=8&version=rv60
cantares,8,9,El poder del amor,"Si ella es muro,
Edificaremos sobre él un palacio de plata;
Si fuere puerta,
La guarneceremos con tablas de cedro.",https://www.biblia.es/biblia-buscar-libros-1.php?libro=cantares&capitulo=8&version=rv60
cantares,8,10,El poder del amor,"Yo soy muro, y mis pechos como torres,
Desde que fui en sus ojos como la que halla paz.",https://www.biblia.es/biblia-buscar-libros-1.php?libro=cantares&capitulo=8&version=rv60
cantares,8,11,El poder del amor,"Salomón tuvo una viña en Baal-hamón,
La cual entregó a guardas,
Cada uno de los cuales debía traer mil monedas de plata por su fruto.",https://www.biblia.es/biblia-buscar-libros-1.php?libro=cantares&capitulo=8&version=rv60
cantares,8,12,El poder del amor,"Mi viña, que es mía, está delante de mí;
Las mil serán tuyas, oh Salomón,
Y doscientas para los que guardan su fruto.",https://www.biblia.es/biblia-buscar-libros-1.php?libro=cantares&capitulo=8&version=rv60
cantares,8,13,El poder del amor,"Oh, tú que habitas en los huertos,
Los compañeros escuchan tu voz;
Házmela oír.",https://www.biblia.es/biblia-buscar-libros-1.php?libro=cantares&capitulo=8&version=rv60
cantares,8,14,El poder del amor,"Apresúrate, amado mío,
Y sé semejante al corzo, o al cervatillo,
Sobre las montañas de los aromas.",https://www.biblia.es/biblia-buscar-libros-1.php?libro=cantares&capitulo=8&version=rv60
